12973	South Dakota	BT North Central States of USA	location
14917	South East Asia	UF Southeast Asia; Southeastern Asia; South East Asian countries; Asia, South East / BT East Asia	location
14578	South Eastern States (USA)	UF Southeastern States of USA; South Eastern States of USA; southeastern region of the United States; Southern United States; South Eastern United States; Southeastern United States / BT Southern States of USA	location
778	South Sudan	UF Republic of South Sudan / BT East Africa	location
15202	Southern Africa	UF Africa, Southern / BT Africa South of Sahara	location
22045	Southern States of USA	UF Southern States (USA) / BT USA	location
25552	Southwestern Asia	BT Asia	location
295	Spain	UF Spanish State; Kingdom of Spain / BT Mediterranean region	location
739	Sri Lanka	UF Ceylon; Republic of Sri Lanka; Democratic Socialist Republic of Sri Lanka / BT South Asia	location
727	Sudan	UF Democratic Republic of the Sudan; Republic of the Sudan / BT East Africa	location
17467	Sulawesi	UF Celebes / BT Indonesia	location
13030	Sumatra	UF Sumatera / BT Indonesia	location
400	Suriname	UF Dutch Guyana; Republic of Suriname; Netherlands Guyana; Surinam; Netherlands Guiana; Guyana, Netherlands; Dutch Guiana / BT South America	location
163	Swaziland	UF Kingdom of Swaziland / BT Southern Africa	location
160	Sweden	UF Kingdom of Sweden / BT Scandinavia	location
397	Switzerland	UF Swiss Confederation / BT Western Europe	location
607	Syria	UF Syrian Arab Republic / BT Middle East; Mediterranean region	location
19306	Tabasco	BT Mexico	location
11158	Taiwan	UF China (Taiwan); Taiwan Province of China; Separate Customs Territory of Taiwan, Penghu, Kinmen and Matsu; Republic of China; Chinese Taipei; Taiwan, Province of China; ROC; Formosa (Taiwan); Taiwan, Province of; ROC (Republic of China) / BT China; South East Asia	location
310	Tajikistan	UF Republic of Tajikistan; Tadzhikistan; Tadzhik SSR; Tajik SSR; Tadzhik Soviet Socialist Republic; Tajik Soviet Socialist Republic / SN Part of USSR before 1992; for documents dealing with that region before the change of status use <7588>; Part of USSR till 1991; to be used for documents dealing with that region before the change of status; later use <33246> / BT USSR; Central Asia	location
27301	Tamaulipas	BT Mexico	location
23716	Tamil Nadu	UF Madras / BT India	location
628	Tanzania	UF United Republic of Tanzania; Tanzania, United Republic of; Tanganyika / BT East Africa	location
11662	Tennessee	BT South Eastern States (USA)	location
4303	Texas	BT Western States of USA	location
376	Thailand	UF Kingdom of Thailand / BT South East Asia	location
19015	Thuringia	BT New Laender	location
26899	Tibet	UF Hsi Tsang; Xizang; Xizang Autonomous Region; Xizhang; Xizang Zizhiqu; Tibet Autonomous Region; China (Tibet); China (Xizhang) / BT China	location
238	Timor-Leste	UF Democratic Republic of Timor-Leste; Loro Sae; Portuguese Timor; East Timor; Timor, East / SN Part of Indonesia before May 2002; for data dealing with that region before the change of status use <4436>; Part of Indonesia till May 2002; to be used for data dealing with that region before the change of status; after the change  use <37893> / BT Nusa Tenggara	location
610	Togo	UF Togolese Republic; Togo (Africa) / SN The African country; for the bug genus, use 'Togo (Hemiptera)'. / BT Francophone Africa; West Africa	location
454	Tokelau	UF Tokelau Islands / BT Pacific Islands	location
457	Tonga	UF Friendly Islands; Kingdom of Tonga / SN The Pacific country; for the planthopper genus, use 'Tonga (Hemiptera)'. / BT Pacific Islands	location
21670	Trentino Alto Adige	UF Trentino-Alto Adige / BT Italy	location
718	Trinidad and Tobago	UF Trinidad; Tobago; Republic of Trinidad and Tobago; Trinidad & Tobago / BT Caribbean	location
20227	tropical Africa	BT Africa	location
28066	tropical America	BT Americas	location
595	Tunisia	UF Republic of Tunisia; Tunis (Tunisia) / BT North Africa; Francophone Africa; Mediterranean region	location
259	Turkey	UF Republic of Turkey; Turkey (country) / BT Europe; Mediterranean region	location
214	Turkmenistan	UF Turkmen SSR; Turkmenia; Turkmen Soviet Socialist Republic / SN Part of USSR before 1992; for documents dealing with that region before the change of status use <8017>; Part of USSR till 1991; to be used for documents dealing with that region before the change of status; later use <15047> / BT USSR; Central Asia	location
157	Turks and Caicos Islands	UF Caicos Islands; Caicos; Turks & Caicos Islands / BT Caribbean	location
11707	Tuscany	UF Toscana / BT Italy	location
631	Tuvalu	UF Ellice Islands; Ellice Island / BT Pacific Islands	location
148	Uganda	UF Republic of Uganda / SN The African country; for the grasshopper genus, use 'Uganda (Orthoptera)'. / BT East Africa	location
622	Ukraine	SN Part of USSR before 1992; for documents dealing with that region before the change of status use <8039> / BT Eastern European region	location
145	Ukrainian SSR	SN Part of USSR till 1991; to be used for documents dealing with that region before the change of status; later use <15070> / BT Eastern European region	location
17494	Umbria (Italy)	UF Umbria / BT Italy	location
385	United Arab Emirates	UF UAE; Trucial States; Umm al Qaiwain; Dubayy; Al Fujayrah; Ash Shariqah; Ajman; Ras al Khaimah; Abu Zaby; Fujairah; Sharjah; Abu Dhabi; Dubai / BT Middle East	location
388	United Kingdom	UF Britain; UK; United Kingdom of Great Britain and Northern Ireland; UK (United Kingdom) / SN United Kingdom of Great Britain and Northern Ireland / BT Europe	location
136	United States Virgin Islands	UF American Virgin Islands; Virgin Islands (USA); U.S. Virgin Islands / BT Caribbean	location
325	Uruguay	UF Eastern Republic of Uruguay / BT Latin America; South America	location
322	USA	UF United States of America; America (United States); U.S.A. (United States); USA (United States); United States / BT North America	location
328	USSR	UF Union of Soviet Socialist Republics; Soviet Union / SN Used for documents published before 1992 or dealing with that country before that date; Use for documents relating to the period when USSR existed as a political entity and where a more specific current designation cannot be ascertained.; Use only for works relating to the period prior to 1991 when the USSR existed as a political entity. / BT Eastern European region; Asia	location
11944	Utah	BT Western States of USA	location
21271	Uttar Pradesh	BT India	location
19861	Uzbek SSR	SN Part of USSR till 1991; to be used for documents dealing with that region before the change of status; later use <15121> / BT USSR; Uzbekistan	location
70	Uzbekistan	UF Republic of Uzbekistan; Uzbek Soviet Socialist Republic / SN Part of USSR before 1992; for documents dealing with that region before the change of status use <8129> / BT Central Asia	location
649	Vanuatu	UF Republic of Vanuatu; New Hebrides / BT Pacific Islands	location
58	Vatican	UF Holy See; Holy See (Vatican); Vatican City State (Holy See); Holy See (Vatican City State); Vatican City State / BT Europe	location
13258	Veneto	BT Italy	location
403	Venezuela	UF Bolivarian Republic of Venezuela; Republic of Venezuela; Venezuela (Bolivarian Republic of); Venezuela, Bolivarian Republic of / SN Name changed from Venezuela to Bolivarian Republic of Venezuela in accordance with 1999 constitutional mandate. Short form: Venezuela (Bolivarian Republic of) / BT Latin America; South America	location
11956	Veracruz	BT Mexico	location
22888	Vermont	BT New England States of USA	location
17158	Victoria	UF Victoria (Australia) / BT Australia	location
460	Vietnam	UF Socialist Republic of Vietnam; Vietnam Democratic Republic; North Vietnam; South Vietnam; Vietnam Republic; Viet Nam; Democratic Republic of Vietnam / BT South East Asia	location
9049	Virginia	SN Use for the state in the United States of America. For the snake use 'Virginia (Serpentes)'. / BT South Eastern States (USA)	location
7	Wake Island	UF American Oceania (Wake Island) / BT Pacific Islands	location
18961	Wales	BT Great Britain	location
4	Wallis and Futuna Islands	UF Wallis and Futuna; Wallis & Futuna / BT Pacific Islands	location
6277	Washington	SN Washington State; not Washington District of Columbia; The State; for D.C. use 'District of Columbia'. / BT Western States of USA	location
8887	West Africa	UF Africa, West; Western Africa / BT Africa South of Sahara	location
27010	West Bengal	BT India	location
19711	West Virginia	BT South Eastern States (USA)	location
17404	Western Australia	BT Australia	location
17653	Western Europe	UF Western European countries; Western European region / BT Europe	location
433	Western Sahara	UF Spanish Sahara; Rio de Oro; Spanish West Africa; Spanish Africa; Rio de Ore / BT West Africa	location
15382	Western States of USA	UF Western States (USA); Western United States / BT USA	location
8833	Wisconsin	BT North Central States of USA	location
3290	world	UF worldwide / SN Use for documents dealing with a given subject on a worldwide scale; Use for documents dealing with a given subject on a worldwide basis. / BT LOCATION	location
10537	Wyoming	BT Western States of USA	location
25078	Xinjiang (Weiwuer)	UF Sinkiang-Igur; Xingjiang Uygur Zizhiqu; Xingjiang Uygur Autonomous Region; China (Sinkiang); Sinkiang; Xingjiang; Xinjiang / BT China; Central Asia	location
172	Yemen	UF Republic of Yemen / SN On May 22, 1990, North Yemen (the Yemen Arab Republic) and Democratic Yemen (the People's Democratic Republic of Yemen) merged to form a new country, the Republic of Yemen (Yemen); before that date use <29192> or <2175> / BT Middle East	location
22756	Yucatan	BT Mexico	location
577	Yugoslavia	UF Jugoslavia; Socialist Federal Republ Yugoslavia; Socialist Federal Republic of Yugoslavia; Yugoslavia, Socialist Federal Republic of; SFRY (Yugoslavia) / SN Used for both the pre-1992, six-member Socialist Federal Republic of Yugoslavia and the two-member Federal Republic of Yugoslavia that succeeded it. The latter changed its name to Serbia and Montenegro on 4 February 2003; for data dealing with that region after the change use <37896>; Use for documents relating to the period when Yugoslavia existed as a political entity and where a more specific designation cannot be ascertained; for Federal Republic of Yugoslavia (1992-2003), use 'Serbia and Montenegro'.; Use for works relating to the period before 1992, when Yugoslavia existed as a political entity; for works after 1992 that refer to the country formed by the union of Serbia and Montengro USE Federal Republic of Yugoslavia. / BT Mediterranean region; Western Europe; Balkans	location
18529	Yunnan	UF China (Yunnan) / BT China	location
40	Zambia	UF Republic of Zambia; Northern Rhodesia / BT Southern Africa	location
20635	Zhejiang	UF Chekiang; China (Chekiang) / BT China	location
421	Zimbabwe	UF Rhodesia; Zimbabwe Rhodesia; Republic of Zimbabwe; Southern Rhodesia / BT Southern Africa	location
