21517	Indian Ocean	BT oceans	location
11173	Indiana	SN The U.S. state. For the nematode genus use 'Indiana (Nematoda)'. / BT North Central States of USA	location
199	Indonesia	UF Republic of Indonesia; Maluku; Lombok; Sunda Islands; Sunda Islands, Lesser; Java (Indonesia); Moluccas; Malay Archipelago; Madura; Timor, Portuguese; Timur; Flores (Indonesia) / BT South East Asia	location
8794	Iowa	BT North Central States of USA	location
694	Iran	UF Islamic Republic of Iran; Iran Islamic Republic; Iran, Islamic Republic of; Iran (Islamic Republic of) / BT Middle East; Southwestern Asia	location
697	Iraq	UF Republic of Iraq / BT Middle East	location
29815	Irian Jaya	UF Irian Barat; West Irian; West New Guinea / BT Indonesia	location
700	Irish Republic	UF Ireland; Eire; Leinster; Munster; Connacht; Munster (Irish Republic) / BT Western Europe	location
304	Israel	BT Middle East; Mediterranean region	location
25777	Italian Marches	UF Marches (Italy) / BT Italy	location
547	Italy	UF Italian Republic; Molise; Emilia-Romagna; South Tyrol; South Tirol; Valle d'Aosta / BT Mediterranean region	location
18262	Jalisco	BT Mexico	location
1	Jamaica	BT Caribbean	location
142	Japan	UF Kyushu; Honshu; Hokkaido; Shikoku / BT Pacific Islands; East Asia	location
8023	Java	UF Djawa; Jawa / BT Indonesia	location
12485	Jersey	BT United Kingdom	location
21286	Jiangsu	UF Kiangsu; China (Kiangsu) / BT China	location
29962	Jiangxi	UF Kiangsi; China (Kiangsi) / BT China	location
31651	Jilin	UF Kirin; China (Kirin) / BT China	location
130	Jordan	UF Hashemite Kingdom of Jordan / BT Middle East	location
17116	Kalimantan	BT Indonesia; Borneo	location
10480	Kansas	BT North Central States of USA	location
24991	Karnataka	UF Mysore / BT India	location
307	Kazakhstan	UF Kazakh SSR; Kazakstan; Republic of Kazakstan; Republic of Kazakhstan / SN Part of USSR before 1992; for documents dealing with that region before the change of status use <4081>; Part of USSR till 1991; to be used for documents dealing with that region before the change of status; later use <11952> / BT USSR; Central Asia	location
11506	Kentucky	BT South Eastern States (USA)	location
439	Kenya	UF Republic of Kenya / BT East Africa	location
28870	Kerala	BT India	location
187	Kiribati	UF Gilbert Islands; Line Islands; Christmas Island (Pacific Ocean); Ocean Island; Phoenix Islands; Christmas Islands (Pacific); Republic of Kiribati; Kiritimati (Christmas Island); Christmas Island (Line Islands); Christmas Island (Pacific) / BT Pacific Islands	location
316	Kuwait	UF State of Kuwait / BT Middle East	location
250	Kyrgyzstan	UF Kirghizia; Republic of Kyrgyzstan; Kirgiz SSR; Kirgiz Soviet Socialist Republic; Kyrgyz Republic / SN Part of USSR before 1992; for documents dealing with that region before the change of status use <4106>; Part of USSR till 1991; to be used for documents dealing with that region before the change of status; later use <33243> / BT USSR; Central Asia	location
31819	La Rioja	BT Argentina	location
30934	Lake Tanganyika	BT Zambia; Democratic Republic of the Congo; Burundi; Tanzania; lakes	location
13366	Languedoc Roussillon	BT France	location
532	Laos	UF Lao; Lao People's Democratic Republic; Lao Peoples Democratic Republic (PDR) / BT South East Asia	location
32731	Lara	BT Venezuela	location
4753	Latin America	UF America, Latin / DF Collectively, those countries in the Western Hemisphere in which  the predominant language is a Romance (French, Spanish, Portuguese) language. / BT Americas	location
17272	Latium	UF Lazio / BT Italy	location
34	Latvia	UF Latvian SSR; Latvian Soviet Socialist Republic / SN Part of USSR before 1992; for documents dealing with that region before the change of status use <4224>; Part of USSR till 1991; to be used for documents dealing with that region before the change of status; later use <12103> / BT USSR	location
625	Lebanon	UF Lebanese Republic; Lebanese / BT Middle East; Mediterranean region	location
646	Lesotho	UF Kingdom of Lesotho; Basutoland / BT Southern Africa	location
30937	Liaoning	UF China (Liaoning) / BT China	location
337	Liberia	UF Republic of Liberia / BT West Africa	location
724	Libya	UF Socialist People's Libyan Arab Jama; Libyan Arab Jamahiriya; Libyan Arab Republic / SN On 16 September 2011, the National Transitional Council requested, via the Protocol and Liaison Service, that the form "Libya", previously not in use at the UN, replace both the earlier official and short forms (respectively, the Socialist People's Libyan Arab Jamahiriya and Libyan Arab Jamahiriya (the)). (Source: UNTERM, 2011) / BT North Africa; Mediterranean region	location
721	Liechtenstein	UF Principality of Liechtenstein / BT Western Europe	location
26737	Liguria	BT Italy	location
29869	Limousin	BT France	location
313	Lithuania	UF Lithuanian SSR; Lithuanian Soviet Socialist Republic / SN Part of USSR before 1992; for documents dealing with that region before the change of status use <4390>; Part of USSR till 1991; to be used for documents dealing with that region before the change of status; later use <12204> / BT USSR	location
12949	Lombardy	BT Italy	location
21661	Lorraine	BT France	location
6898	Louisiana	BT South Eastern States (USA)	location
30520	Lower Normandy	BT France	location
7282	Lower Saxony	UF Niedersachsen / BT Germany	location
751	Luxembourg	UF Grand Duchy of Luxembourg / BT Western Europe	location
583	Macau	UF Macao / SN Use for materials covering the period prior to 20 December 1999, the date when the territory of Macau, then under Portuguese administration, was returned to China and became the Macao Special Administrative Region. (Source: UNBIS Thesaurus, 2010); after the change of status use: Macao (China). / BT East Asia	location
742	Madagascar	UF Democratic Republic of Madagascar; Malagasy Republic / BT Francophone Africa; East Africa	location
31294	Madhya Pradesh	BT India	location
26080	Maharashtra	BT India	location
15970	Maine	BT New England States of USA	location
667	Malawi	UF Republic of Malawi; Nyasaland / BT Southern Africa; East Africa	location
670	Malaysia	UF West Malaysia; Malaya (country) / BT South East Asia	location
664	Maldives	UF Republic of Maldives / BT South Asia	location
190	Mali	UF Republic of Mali / BT Francophone Africa; West Africa	location
430	Malta	BT Mediterranean region	location
24805	Manitoba	BT Canada	location
31852	Maranhao	BT Brazil	location
373	Marshall Islands	UF Republic of the Marshall Islands; American Oceania (Marshall Islands) / SN The Marshall Islands were once part of the Trust Territory of the Pacific Islands. They now form the Republic of the Marshall Islands. / DF Source: ILO, 2005 / BT Pacific Islands	location
23959	Martinique	UF French West Indies (Martinique) / BT French West Indies	location
10429	Maryland	BT North Eastern States (USA)	location
13588	Massachusetts	UF Cape Cod / BT New England States of USA	location
26728	Mato Grosso	BT Brazil	location
20956	Mato Grosso do Sul	BT Brazil	location
82	Mauritania	UF Islamic Republic of Mauritania / BT Francophone Africa; West Africa	location
85	Mauritius	UF Republic of Mauritius / BT East Africa	location
478	Mayotte	UF Comorian Island of Mayotte; Territorial Collectivity of Mayotte; Overseas Collectivity of Mayotte / BT Comoros	location
18604	Mecklenburg-Western Pomerania	UF Mecklenburg-Pomerania / BT New Laender	location
13807	Mediterranean region	UF Mediterranean countries / SN For the climatic zone use MEDITERRANEAN ZONE / BT geographical regions	location
13156	Mediterranean Sea	BT seas	location
673	Mexico	UF United Mexican States / BT Latin America; North America	location
20767	Mexico (Province)	BT Mexico	location
7003	Michigan	BT North Central States of USA	location
15154	Michoacan	BT Mexico	location
580	Micronesia (Federated States of)	UF Federated States of Micronesia; Micronesia, Federated States of / SN Comprises the Caroline Islands except for Palau; Use for the island group in the Caroline Islands that is an independent country under a Compact of Free Association with the United States; For the large geographic area of Oceania which includes the principal island groups:  Caroline Islands, Nauru, Kiribati, the Northern Mariana Islands, and the Marshall Islands USE Micronesia. / DF Source: UNBIS, 2006 / BT Caroline Islands	location
13246	Middle East	UF Near East / DF An extensive region comprising the countries of southwest Asia and northeast Africa / BT geographical regions	location
18337	Midi Pyrenees	BT France	location
541	Midway Islands	BT Pacific Islands	location
9202	Minas Gerais	BT Brazil	location
7477	Minnesota	BT North Central States of USA	location
8101	Mississippi	BT South Eastern States (USA)	location
10993	Missouri	BT North Central States of USA	location
22855	Moldavian SSR	SN Part of USSR till 1991; to be used for documents dealing with that region before the change of status; later use <33245> / BT Moldova; USSR	location
256	Moldova	UF Moldova (Republic); Moldavia; Republic of Moldova; Moldova, Republic of; Moldavian Soviet Socialist Republic / SN Part of USSR before 1992; for documents dealing with that region before the change of status use <4890>. Short name Moldova changed back to Republic of Moldova on 09.09.2008 / BT Eastern European region	location
496	Monaco	UF Principality of Monaco / BT Mediterranean region; Western Europe	location
30421	Monagas	BT Venezuela	location
757	Mongolia	UF Mongolian People's Republic; Mongolia People's Republic; Outer Mongolia / BT East Asia; Central Asia	location
9565	Montana	BT Western States of USA	location
283	Montenegro	UF Republic of Montenegro; Crna Gora / SN Part of "Serbia and Montenegro" till 03.6.2006 / BT Mediterranean region; Balkans	location
514	Montserrat	BT Caribbean	location
30289	Morelos	BT Mexico	location
301	Morocco	UF Kingdom of Morocco / BT North Africa; Francophone Africa; Mediterranean region	location
61	Mozambique	UF Portuguese East Africa; Republic of Mozambique / BT Southern Africa	location
469	Myanmar	UF Burma; Union of Myanmar; Republic of the Union of Myanmar; Socialist Republic of Burma; Republic of the Union of Myarmar / BT South East Asia	location
535	Namibia	UF Republic of Namibia; South West Africa / BT Southern Africa	location
133	Nauru	UF Pleasant Island; Republic of Nauru / BT Pacific Islands; islands	location
8704	Nebraska	BT North Central States of USA	location
26497	Nei Mongol	UF Inner Mongolia; Neimenggu; Nei Monggol; Nei Mongol Zizhiqu; Nei Monggol Zizhiqu; Inner Mongolia Autonomous Region; Nei Menggu; China (Inner Mongolia); Neimongol Zizhiqu; Nei Mongol Autonomous Region / BT China	location
472	Nepal	UF Kingdom of Nepal / BT South Asia	location
178	Netherlands	UF Noord-Holland; Utrecht; Gelderland; Drenthe; Friesland; Noord-Brabant; Kingdom of the Netherlands; Groningen; Holland; Overijssel; Limburg; Zeeland; Zuid-Holland; Flevoland; Netherlands (Groningen); Netherlands (Friesland); Netherlands (Limburg); Netherlands (N. Holland); South Limbourg; North Holland; Netherlands (Flevoland); Netherlands (Drenthe); Netherlands (Overijssel); Netherlands (Zeeland); Netherlands (Gelderland); Netherlands (S. Limbourg); North Brabant; Netherlands (S. Holland); Netherlands (N. Brabant); Netherlands (Utrecht); South Holland; Friesland (Netherlands); Zuid-Limbourg / BT Western Europe	location
181	Netherlands Antilles	UF St Maarten; Antilles, Netherlands; St Eustatius; Saba; Bonaire; Saint Eustatius; Curacao; Saint Maarten / SN On 10 October 2010, the Netherlands Antilles officially ceased to exist. Curaçao and Sint Maarten have become two new constituent countries. Aruba retains the separate country status it has had since 1986. The three other islands, Bonaire, Sint Eustatius and Saba, have been integrated into the Netherlands. (Source: UNTERM, 2011) / BT Caribbean	location
15244	Nevada	BT Western States of USA	location
31372	New Brunswick	BT Canada	location
691	New Caledonia	BT Pacific Islands	location
27949	New England States of USA	UF New England; New England region / DF Region in Northeast section of the United States, including Connecticut, Maine, Massachusetts, New Hampshire, Rhode Island, and Vermont. / BT North Eastern States (USA)	location
22852	New Hampshire	BT New England States of USA	location
13396	New Jersey	BT North Eastern States (USA)	location
21649	New Laender	BT Germany	location
11224	New Mexico	BT Western States of USA	location
17101	New South Wales	BT Australia	location
6550	New York	UF New York State / BT North Eastern States (USA)	location
223	New Zealand	BT Pacific Islands	location
658	Nicaragua	UF Republic of Nicaragua / BT Latin America; Central America	location
352	Niger	UF Republic of the Niger; Niger (country) / BT Francophone Africa; West Africa	location
349	Nigeria	UF Federal Republic of Nigeria; Benin (Nigeria) / BT West Africa	location
76	Niue	UF Republic of Niue / BT Oceania	location
29689	Nord Pas de Calais	BT France	location
538	Norfolk Island	BT Pacific Islands; islands	location
14644	North Africa	UF Maghreb; Africa, North; Northern Africa / BT Africa	location
7624	North America	UF North American continent; America, North / BT Americas	location
7726	North Carolina	BT South Eastern States (USA)	location
21076	North Central States of USA	UF North Central States (USA); Central United States; Midwest United States; Midwestern States of USA; South Central States of USA; South Central United States; North Central United States; Central States of USA; Midwestern United States / BT USA	location
11101	North Dakota	BT North Central States of USA	location
20128	North Eastern States (USA)	UF Northeastern States of USA; North Eastern States of USA; North Eastern United States; Northeastern United States / BT USA	location
15250	North Rhine-Westphalia	UF Nordrhein-Westfalen / BT Germany	location
21409	North Sea	UF Wadden Sea / BT Northeast Atlantic; seas	location
229	North Yemen	UF Yemen Arab Republic / SN To be used for documents published before May 1990 or dealing with the situation in the region until May 21, 1990; later use <8483>. On May 22, 1990, the Yemen Arab Republic (North Yemen) and the People's Democratic Republic of Yemen (Democratic Yemen) merged to form a new country, the Republic of Yemen (Yemen) / BT geographical regions	location
30454	Northeast Atlantic	UF Atlantic Northeast; Atlantic, Northeast / BT Atlantic Ocean	location
26788	Northern Ireland	UF Ireland, Northern / BT United Kingdom; Irish Republic	location
415	Northern Mariana Islands	UF Mariana Islands; CNMI; Commonwealth of the Northern Mariana Islands; Alamagan (island); Farallon de Medinilla; Farallon de Pajaros; Asuncion (island); Anatahan (island); Pagan (island); Aguijan (island); Maug Islands; Agrihan (island); Sarigan (island); Guguan (island) / SN The Mariana Islands were previously part of the Trust Territory of the Pacific Islands. They are now known formally as the Commonwealth of the Northern Mariana Islands. / DF Source: ILO, 2005 / BT Oceania	location
18676	Northwest Pacific	UF Pacific, Northwest; Pacific Northwest / BT Pacific Ocean	location
268	Norway	UF Kingdom of Norway; Spitsbergen / BT Scandinavia	location
32350	Nova Scotia	BT Canada	location
28780	Nusa Tenggara	UF Flores (Nusa); Lesser Sunda Islands; Flores / BT Indonesia	location
20848	Oaxaca	BT Mexico	location
13531	Oceania	UF Polynesia; Australasia / BT geographical regions	location
8920	Ohio	BT North Central States of USA	location
8449	Oklahoma	BT North Central States of USA	location
637	Oman	UF Sultanate of Oman; Muscat and Oman / BT Middle East	location
9793	Ontario	BT Canada	location
5812	Oregon	BT Western States of USA	location
31726	Orissa	BT India	location
25489	Pacific Islands	UF Midway Atoll; Futuna; Easter Island; Pacific Ocean Islands / BT Oceania	location
20896	Pacific Ocean	BT oceans	location
508	Pakistan	UF Islamic Republic of Pakistan; PK (ISO 3166); Sind; Pakistan Northwest Frontier; Pakistan Tribal Areas; Islamabad; Baluchistan; Punjab, Pakistan; Pakistan Punjab / BT South Asia	location
568	Palau	UF Belau; Republic of Palau / SN Palau was once part of the Trust Territory of the Pacific Islands. It became independent from the United States on 1st October 1994. / BT Caroline Islands	location
115	Palestine	UF PSE (ISO 3166); Palestinian National Authority; Occupied Palestinian Territory; PS (ISO 3166) / BT Middle East	location
526	Panama	UF Republic of Panama / BT Latin America; Central America	location
529	Panama Canal Zone	UF Canal Zone / SN Use for documents relating to the period when 'Panama Canal Zone' existed as a political entity (1903-1999). / BT Panama	location
31	Papua New Guinea	UF Independent State of Papua New Guinea; Bismarck Archipelago; Papua and New Guinea / SN Use for works referring to the period after 1975; For works relating to the period prior to 1975 when New Guinea existed as a political entity, or for works relating to any time period that refer to the island as a whole USE New Guinea. / BT Oceania	location
16339	Para	BT Brazil	location
379	Paraguay	UF Republic of Paraguay / BT Latin America; South America	location
25438	Paraiba	BT Brazil	location
15328	Parana	BT Brazil	location
21310	Pays de la Loire	BT France	location
18541	Peninsular Malaysia	UF Malaya / BT Malaysia	location
10783	Pennsylvania	BT North Eastern States (USA)	location
21715	Pernambuco	BT Brazil	location
31006	Persian Gulf	UF Arabian Gulf; Persian-Arabian Gulf; Arab Gulf / BT LOCATION	location
574	Peru	UF Republic of Peru / BT Latin America; South America	location
484	Philippines	UF Republic of the Philippines; Philippine Archipelago; Philippine Islands / BT Pacific Islands; South East Asia	location
30184	Piaui	BT Brazil	location
24208	Picardy	BT France	location
12541	Piedmont (Italy)	BT Italy	location
520	Pitcairn Islands	UF Pitcairn Island; Pitcairn; Pitcairn, Henderson, Ducie, and Oeno Islands; Pitcairn, Henderson, Ducie and Oeno Islands; Pitcairn, Henderson, Ducie & Oeno Islands / BT Pacific Islands	location
25732	Poitou Charentes	BT France	location
226	Poland	UF Republic of Poland; Polish People's Republic / BT Eastern European region	location
55	Portugal	UF Portuguese Republic / BT Mediterranean region	location
30490	Portuguesa	BT Venezuela	location
16642	Provence Alpes Cote d'Azur	UF Provence-Alpes-Cote d'Azur / BT France	location
22828	Puebla	BT Mexico	location
544	Puerto Rico	UF Porto Rico / BT Latin America; Caribbean	location
21955	Punjab (India)	UF Punjab; Indian Punjab / BT India	location
370	Qatar	UF Umm Said; State of Qatar / BT Middle East	location
14338	Quebec	UF Province of Quebec / BT Canada	location
11380	Queensland	BT Australia	location
27403	Rajasthan	BT India	location
679	Republic of Georgia	UF Georgian SSR; Georgian Soviet Socialist Republic; Georgia, Republic of / SN Part of USSR before 1992; for documents dealing with that region before the change of status use <3237> / BT Asia	location
319	Republic of Korea	UF South Korea; Korea Republic; Korea, South; Korea, Republic of; ROK (Republic of Korea) / BT East Asia	location
17515	Reunion	UF Réunion; Réunion Island; Reunion Island / BT Francophone Africa; East Africa	location
21352	Rhineland Palatinate	UF Rhineland-Palatinate; Rheinland Pfalz / BT Germany	location
31336	Rhode Island	BT New England States of USA	location
18082	Rhone Alpes	BT France	location
21868	Rio de Janeiro	BT Brazil	location
31297	Rio Grande do Norte	BT Brazil	location
10258	Rio Grande do Sul	BT Brazil	location
355	Romania	UF Socialist Republic of Romania; Rumania; ROU (ISO 3166); ROM (ISO 3166); RO (ISO 3166) / BT Eastern European region; Balkans	location
13426	RSFSR	UF Russian Soviet Federal Socialist Republic / SN Russian Socialist Federal Soviet Republic; part of USSR till 24 December 1991; to be used for documents dealing with that region before the change of status; later use <33240> / BT Russia; USSR	location
253	Russia	UF Russian Federation; RSFSR in Europe; Russian Socialist Federal Soviet Republic; RSFSR west of Urals; RSFSR in Asia; RSFSR (Russia) / SN Part of USSR before 24 December 1991; for documents dealing with that region before the change of status use <6675> / BT Eastern European region; Asia	location
598	Rwanda	UF Republic of Rwanda; Rwandese Republic / BT Francophone Africa; East Africa; Central Africa	location
27070	Sabah	BT Borneo; Malaysia	location
26228	sahara desert	UF libyan desert / BT LOCATION	location
9151	Sahel	UF Sahelian zone; Africa (Sahelian Zone) / DF A dryland belt that stretches across Africa and is the transition zone between the Sahara Desert to the north and tropical forests to the south. / BT climatic zones; Africa South of Sahara	location
37	Saint Helena, Ascension and Tristan da Cunha	BT Southern Africa	location
346	Saint Kitts and Nevis	UF St Kitts Nevis; Saint Kitts Nevis; St Christopher and Nevis; Saint Christopher and Nevis; Nevis; St Kitts and Nevis; St. Kitts-Nevis; St. Kitts & Nevis; Federation of Saint Kitts and Nevis; St. Kitts and Nevis; Saint Kitts & Nevis; St Kitts & Nevis; St Kitts-Nevis; St. Kitts Nevis; Federation of Saint Christopher and Nevis; Saint Christopher & Nevis / BT Caribbean	location
736	Saint Lucia	UF St Lucia; St. Lucia / BT Caribbean	location
340	Saint Pierre and Miquelon	UF St Pierre and Miquelon; Overseas Collectivity of Saint Pierre and Miquelon; St. Pierre and Miquelon; Saint Pierre et Miquelon; Saint-Pierre-et-Miquelon; Territorial Collectivity of Saint Pierre and Miquelon / BT North America	location
592	Saint Vincent and the Grenadines	UF St Vincent and the Grenadines; St. Vincent & the Grenadines; St. Vincent and the Grenadines; St Vincent & the Grenadines; Saint Vincent & the Grenadines; Grenadines / BT Caribbean	location
775	Samoa	UF Independent State of Western Samoa; Independent State of Samoa; Western Samoa; WS (ISO 3166); WSM (ISO 3166) / DF A group  of islands in the SW Pacific Ocean divided into American Samoa (administered by the U.S. Department of Interior) and Western Samoa (an independant country) / BT Pacific Islands	location
772	San Marino	UF Republic of San Marino / BT Europe; Mediterranean region	location
20614	Santa Catarina	BT Brazil	location
8521	Sao Paulo	BT Brazil	location
442	Sao Tome and Principe	UF Principe; San Thome and Principe; Democratic Republic of Sao Tome and Principe / BT Central Africa	location
25765	Sarawak	BT Borneo; Malaysia	location
15793	Sardinia	UF Sardegna / BT Italy	location
21010	Saskatchewan	BT Canada	location
298	Saudi Arabia	UF Kingdom of Saudi Arabia / BT Middle East	location
15997	Saxony	BT New Laender	location
19630	Saxony-Anhalt	BT New Laender	location
11212	Scandinavia	UF Fennoscandia; Fennoscandinavia; Nordic countries; Fenno-Scandinavia / DF A region encompassing Denmark, Norway, and Sweden, sometimes expanded to include Finland and Iceland. / BT Europe	location
20998	Schleswig-Holstein	BT Germany	location
12856	Scotland	UF Orkney Islands; Shetland Islands; Eastern Scotland; Northern Scotland; Ayrshire (Scotland); Scottish Highlands and Islands; Highlands and Islands of Scotland; West Scotland / BT Great Britain	location
18934	Sea of Japan	UF East Sea (Sea of Japan) / BT Northwest Pacific; seas	location
769	Senegal	UF Republic of Senegal / BT Francophone Africa; West Africa	location
32710	Senegal River	BT rivers	location
286	Serbia	UF Republic of Serbia; Srbija / SN Part of "Serbia and Montenegro" till 03.6.2006 / BT Mediterranean region; Balkans	location
241	Serbia and Montenegro	UF Federal Republic of Yugoslavia; SCG (ISO 3166); CS (ISO 3166); YUG (ISO 3166); YU (ISO 3166) / SN The name of the Federal Republic of Yugoslavia (Yugoslavia) was changed to Serbia and Montenegro as of 4 February 2003; for data dealing with that region before the change use <8494>. Montenegro seceded from the federation on 3 June 2006, leaving the Republic of Serbia shortly thereafter to declare itself legal successor to the State Union of Serbia and Montenegro.; Use for documents relating to the period when 'Serbia and Montenegro' existed as a political entity (2003-2006) and when 'Federal Republic of Yugoslavia' had the same territorial extent (1992-2003), and where a more specific designation cannot be ascertained. / BT Mediterranean region; Balkans	location
505	Seychelles	UF Republic of Seychelles; Aldabra / BT East Africa	location
25129	Shaanxi	UF Shensi; Shenxi; China (Shensi) / BT China	location
25156	Shandong	UF Shantung; China (Shantung) / BT China	location
32407	Shanghai	UF China (Shanghai); Shanghai Shi; Shanghai Municipality / BT China	location
27463	Shanxi	UF Shansi; China (Shansi) / BT China	location
18247	Sichuan	UF Szechwan; China (Szechwan) / BT China	location
9958	Sicily	UF Sicilia / BT Italy	location
124	Sierra Leone	UF Republic of Sierra Leone / BT West Africa	location
289	Sikkim	BT India	location
745	Singapore	UF Republic of Singapore / BT Pacific Islands; South East Asia	location
445	Slovakia	UF Slovak Republic; Slovak Socialist Republic / SN Part of CSFR till 31.12.1992; Use for works referring to the period after January 1993;  For works relating to the period prior to January 1993 when Czechoslovakia existed as a political entity USE Czechoslovakia. / BT Eastern European region	location
193	Slovenia	UF Republic of Slovenia / BT Mediterranean region; Balkans	location
232	Solomon Islands	UF Santa Cruz Islands; Guadalcanal; British Solomon Islands / BT Pacific Islands	location
235	Somalia	UF Somali Democratic Republic; Somali Republic; Federal Republic of Somalia / BT East Africa	location
8656	Sonora	BT Mexico	location
481	South Africa	UF Republic of South Africa; South African Republic; Ciskei; Bophuthatswana; Lebowa; ZA (ISO 3166); South African Homelands; Bantustan; Kwazulu; Venda; Transkei; Orange Free State; Homelands, South Africa / BT Southern Africa	location
11434	South America	UF South American countries; America, South; South American continent / BT Americas	location
22981	South Asia	UF Asia, South; South Asian countries / BT Asia	location
27943	South Australia	BT Australia	location
12928	South Carolina	BT South Eastern States (USA)	location
